<?xml version="1.0" encoding="UTF-8" standalone="yes"?>
<xs:papers xmlns:xsi="http://www.w3.org/2001/XMLSchema-instance"
           xmlns:xs="http://www.example.com/students"
           xsi:schemaLocation="http://www.example.com/papers.xsd">
    <xs:newspaper id="1" name="Weekly Newspaper">
        <xs:monthly>false</xs:monthly>
        <xs:color>false</xs:color>
        <xs:volume>200</xs:volume>
        <xs:subscription-index>12445800</xs:subscription-index>
        <xs:first-publication>1970-12-12</xs:first-publication>
    </xs:newspaper>

    <xs:newspaper id="2" name="Monthly Newspaper">
        <xs:monthly>true</xs:monthly>
        <xs:color>false</xs:color>
        <xs:volume>42</xs:volume>
        <xs:subscription-index>278665123</xs:subscription-index>
        <xs:first-publication>2000-04-02</xs:first-publication>
    </xs:newspaper>

    <xs:magazine id="3" name="Some magazine">
        <xs:monthly>true</xs:monthly>
        <xs:color>true</xs:color>
        <xs:glossy>true</xs:glossy>
        <xs:volume>300</xs:volume>
        <xs:subscription-index>65827465</xs:subscription-index>
        <xs:first-publication>2015-08-04</xs:first-publication>
    </xs:magazine>

    <xs:magazine id="4" name="Some other magazine">
        <xs:monthly>false</xs:monthly>
        <xs:color>true</xs:color>
        <xs:glossy>false</xs:glossy>
        <xs:volume>60</xs:volume>
        <xs:subscription-index>76683550</xs:subscription-index>
        <xs:first-publication>2008-01-11</xs:first-publication>
    </xs:magazine>

    <xs:magazine id="5" name="Elle">
        <xs:monthly>false</xs:monthly>
        <xs:color>true</xs:color>
        <xs:glossy>true</xs:glossy>
        <xs:volume>120</xs:volume>
        <xs:subscription-index>65588476</xs:subscription-index>
        <xs:first-publication>1999-11-09</xs:first-publication>
    </xs:magazine>

    <xs:magazine id="6" name="Il">
        <xs:monthly>true</xs:monthly>
        <xs:color>true</xs:color>
        <xs:glossy>true</xs:glossy>
        <xs:volume>185</xs:volume>
        <xs:subscription-index>23315065</xs:subscription-index>
        <xs:first-publication>1995-02-10</xs:first-publication>
    </xs:magazine>

    <xs:booklet id="7" name="Gastrofest booklet">
        <xs:monthly>false</xs:monthly>
        <xs:color>true</xs:color>
        <xs:glossy>false</xs:glossy>
        <xs:volume>2</xs:volume>
        <xs:first-publication>2017-08-07</xs:first-publication>
    </xs:booklet>

    <xs:booklet id="8" name="OSTIS booklet">
        <xs:monthly>false</xs:monthly>
        <xs:color>true</xs:color>
        <xs:glossy>false</xs:glossy>
        <xs:volume>5</xs:volume>
        <xs:first-publication>2011-02-17</xs:first-publication>
    </xs:booklet>

    <xs:booklet id="9" name="BSUIR booklet">
        <xs:monthly>false</xs:monthly>
        <xs:color>true</xs:color>
        <xs:glossy>false</xs:glossy>
        <xs:volume>3</xs:volume>
        <xs:first-publication>2015-08-31</xs:first-publication>
    </xs:booklet>

    <xs:magazine id="10" name="Yet another magazine">
        <xs:monthly>true</xs:monthly>
        <xs:color>true</xs:color>
        <xs:glossy>true</xs:glossy>
        <xs:volume>40</xs:volume>
        <xs:subscription-index>56648803</xs:subscription-index>
        <xs:first-publication>2013-03-14</xs:first-publication>
    </xs:magazine>

    <xs:magazine id="11" name="We need more magazines">
        <xs:monthly>false</xs:monthly>
        <xs:color>true</xs:color>
        <xs:glossy>true</xs:glossy>
        <xs:volume>58</xs:volume>
        <xs:subscription-index>11938803</xs:subscription-index>
        <xs:first-publication>2013-10-15</xs:first-publication>
    </xs:magazine>

    <xs:magazine id="12" name="Another magazine">
        <xs:monthly>false</xs:monthly>
        <xs:color>true</xs:color>
        <xs:glossy>true</xs:glossy>
        <xs:volume>66</xs:volume>
        <xs:subscription-index>00198597</xs:subscription-index>
        <xs:first-publication>01-12-2003</xs:first-publication>
    </xs:magazine>

    <xs:newspaper id="13" name="Some newspaper">
        <xs:monthly>false</xs:monthly>
        <xs:color>true</xs:color>
        <xs:volume>66</xs:volume>
        <xs:subscription-index>10097594</xs:subscription-index>
        <xs:first-publication>20-11-2007</xs:first-publication>
    </xs:newspaper>

    <xs:newspaper id="14" name="Another newspaper">
        <xs:monthly>false</xs:monthly>
        <xs:color>false</xs:color>
        <xs:volume>24</xs:volume>
        <xs:subscription-index>21775649</xs:subscription-index>
        <xs:first-publication>21-12-2012</xs:first-publication>
    </xs:newspaper>

    <xs:newspaper id="15" name="Newspaper Number N">
        <xs:monthly>false</xs:monthly>
        <xs:color>false</xs:color>
        <xs:volume>19</xs:volume>
        <xs:subscription-index>44726539</xs:subscription-index>
        <xs:first-publication>29-05-2011</xs:first-publication>
    </xs:newspaper>

    <xs:newspaper id="16" name="Newspaper Number N+1">
        <xs:monthly>false</xs:monthly>
        <xs:color>false</xs:color>
        <xs:volume>21</xs:volume>
        <xs:subscription-index>32336284</xs:subscription-index>
        <xs:first-publication>11-02-1997</xs:first-publication>
    </xs:newspaper>
</xs:papers>